,number,value,datetime_start,datetime_complete,duration,params_bootstrap,params_class_weight,params_criterion,params_max_depth,params_max_features,params_max_leaf_nodes,params_n_estimators,state
0,0,0.6538955258977575,2023-04-11 15:24:52.588399,2023-04-11 15:24:57.087757,0 days 00:00:04.499358,False,2.926676457551585,entropy,10,23,5,69,COMPLETE
1,1,0.5,2023-04-11 15:24:57.089772,2023-04-11 15:25:06.077480,0 days 00:00:08.987708,False,14.492420007647977,entropy,2,1,11,312,COMPLETE
2,2,0.6414550189818473,2023-04-11 15:25:06.079478,2023-04-11 15:25:18.961838,0 days 00:00:12.882360,True,2.4794893686194825,log_loss,8,20,13,189,COMPLETE
3,3,0.5520702149158568,2023-04-11 15:25:18.963838,2023-04-11 15:25:23.191201,0 days 00:00:04.227363,True,12.59775276823546,log_loss,2,9,4,102,COMPLETE
4,4,0.6473318779798461,2023-04-11 15:25:23.193178,2023-04-11 15:25:32.112511,0 days 00:00:08.919333,False,11.039757566150133,log_loss,7,22,7,120,COMPLETE
5,5,0.6496435599393284,2023-04-11 15:25:32.114510,2023-04-11 15:25:50.833009,0 days 00:00:18.718499,True,19.26498784117168,gini,10,22,16,245,COMPLETE
6,6,0.5,2023-04-11 15:25:50.835009,2023-04-11 15:26:01.153845,0 days 00:00:10.318836,False,14.741197397605951,gini,7,7,2,328,COMPLETE
7,7,0.5432453241033036,2023-04-11 15:26:01.155870,2023-04-11 15:26:15.324735,0 days 00:00:14.168865,False,18.289077158700234,entropy,5,6,14,329,COMPLETE
8,8,0.6332497312057856,2023-04-11 15:26:15.326735,2023-04-11 15:26:41.748173,0 days 00:00:26.421438,True,2.396140418634141,entropy,25,28,12,392,COMPLETE
9,9,0.4995371424235526,2023-04-11 15:26:41.750171,2023-04-11 15:26:53.159108,0 days 00:00:11.408937,False,18.53036632658941,gini,18,9,3,327,COMPLETE
10,10,0.6941850716725697,2023-04-11 15:26:53.161106,2023-04-11 15:26:58.034002,0 days 00:00:04.872896,False,6.580135097168341,entropy,16,30,20,42,COMPLETE
11,11,0.6938069805217506,2023-04-11 15:26:58.036001,2023-04-11 15:27:01.427269,0 days 00:00:03.391268,False,6.234552599896132,entropy,16,29,20,29,COMPLETE
12,12,0.6861214226670127,2023-04-11 15:27:01.429266,2023-04-11 15:27:07.993443,0 days 00:00:06.564177,False,7.361148941246473,entropy,17,30,20,58,COMPLETE
13,13,0.6770462694184746,2023-04-11 15:27:07.996444,2023-04-11 15:27:11.122715,0 days 00:00:03.126271,False,7.411086427265812,entropy,16,27,20,27,COMPLETE
14,14,0.6971392658579065,2023-04-11 15:27:11.124697,2023-04-11 15:27:25.341722,0 days 00:00:14.217025,False,6.78951864380153,entropy,25,17,17,170,COMPLETE
15,15,0.6799722073064824,2023-04-11 15:27:25.343721,2023-04-11 15:27:36.687785,0 days 00:00:11.344064,False,5.603910528533284,entropy,32,14,17,168,COMPLETE
16,16,0.7016457291742958,2023-04-11 15:27:36.689804,2023-04-11 15:27:48.857267,0 days 00:00:12.167463,False,9.251923850253467,entropy,23,16,17,144,COMPLETE
17,17,0.6771494273606585,2023-04-11 15:27:48.860264,2023-04-11 15:28:04.645302,0 days 00:00:15.785038,False,9.458546919813895,entropy,25,16,10,231,COMPLETE
18,18,0.7005392202326778,2023-04-11 15:28:04.648300,2023-04-11 15:28:13.206986,0 days 00:00:08.558686,True,9.355445172052805,gini,24,15,17,140,COMPLETE
19,19,0.6991071549223549,2023-04-11 15:28:13.210004,2023-04-11 15:28:20.005529,0 days 00:00:06.795525,True,9.83434499616017,gini,21,13,15,122,COMPLETE
20,20,0.6822689156541552,2023-04-11 15:28:20.007528,2023-04-11 15:28:33.245153,0 days 00:00:13.237625,True,9.579700171041777,gini,31,12,9,276,COMPLETE
21,21,0.68608268408099,2023-04-11 15:28:33.247153,2023-04-11 15:28:40.815679,0 days 00:00:07.568526,True,10.822275982340233,gini,21,13,15,129,COMPLETE
22,22,0.7041842942763306,2023-04-11 15:28:40.817682,2023-04-11 15:28:50.144428,0 days 00:00:09.326746,True,8.309260191878314,gini,22,18,18,142,COMPLETE
23,23,0.6938721267577475,2023-04-11 15:28:50.146425,2023-04-11 15:29:00.164945,0 days 00:00:10.018520,True,8.303260768888507,gini,28,18,18,158,COMPLETE
24,24,0.6874916434535814,2023-04-11 15:29:00.166944,2023-04-11 15:29:06.533059,0 days 00:00:06.366115,True,5.237971501551696,gini,22,19,18,91,COMPLETE
25,25,0.6723388825220807,2023-04-11 15:29:06.535060,2023-04-11 15:29:21.822356,0 days 00:00:15.287296,True,4.409591479324216,gini,28,25,18,205,COMPLETE
26,26,0.6894720682613261,2023-04-11 15:29:21.824351,2023-04-11 15:29:30.404481,0 days 00:00:08.580130,True,8.716317581579569,gini,23,15,14,154,COMPLETE
27,27,0.7154078048720518,2023-04-11 15:29:30.406491,2023-04-11 15:29:34.839829,0 days 00:00:04.433338,True,8.117220484297938,log_loss,13,11,16,85,COMPLETE
28,28,0.6792847355719045,2023-04-11 15:29:34.841828,2023-04-11 15:29:39.343190,0 days 00:00:04.501362,True,8.038804726313906,log_loss,13,11,16,86,COMPLETE
29,29,0.6871129128861597,2023-04-11 15:29:39.345188,2023-04-11 15:29:41.978399,0 days 00:00:02.633211,True,4.46456521468065,log_loss,13,4,13,68,COMPLETE
30,30,0.6683623085739487,2023-04-11 15:29:41.981401,2023-04-11 15:29:46.920798,0 days 00:00:04.939397,True,3.283260227837024,log_loss,20,10,8,108,COMPLETE
31,31,0.6941671728936305,2023-04-11 15:29:46.922798,2023-04-11 15:29:56.306989,0 days 00:00:09.384191,True,8.68357838558573,log_loss,19,20,18,135,COMPLETE
32,32,0.6972315641234267,2023-04-11 15:29:56.309005,2023-04-11 15:30:07.567596,0 days 00:00:11.258591,True,11.167940306954733,gini,13,16,16,190,COMPLETE
33,33,0.5995784536005274,2023-04-11 15:30:07.569597,2023-04-11 15:30:16.710736,0 days 00:00:09.141139,True,1.3169307114007056,log_loss,26,15,19,145,COMPLETE
34,34,0.6960396695542928,2023-04-11 15:30:16.713734,2023-04-11 15:30:22.600711,0 days 00:00:05.886977,True,7.576521746047574,log_loss,23,20,17,74,COMPLETE
35,35,0.5403469495153634,2023-04-11 15:30:22.602713,2023-04-11 15:30:30.372066,0 days 00:00:07.769353,True,11.988006558681152,gini,28,1,12,193,COMPLETE
36,36,0.6651014395196507,2023-04-11 15:30:30.375064,2023-04-11 15:30:37.434651,0 days 00:00:07.059587,True,9.839645719419972,log_loss,10,23,6,105,COMPLETE
37,37,0.706282808462003,2023-04-11 15:30:37.436649,2023-04-11 15:30:52.404324,0 days 00:00:14.967675,True,8.787132036020648,gini,23,18,15,223,COMPLETE
38,38,0.6910953471990895,2023-04-11 15:30:52.406305,2023-04-11 15:31:07.407801,0 days 00:00:15.001496,True,8.324844967856013,log_loss,14,19,15,227,COMPLETE
39,39,0.6507575870938511,2023-04-11 15:31:07.410802,2023-04-11 15:31:26.766362,0 days 00:00:19.355560,False,12.188511589129714,gini,19,22,13,259,COMPLETE
40,40,0.6803838344583817,2023-04-11 15:31:26.769364,2023-04-11 15:31:39.464049,0 days 00:00:12.694685,True,10.498565000490196,entropy,11,7,14,286,COMPLETE
41,41,0.6870681510026052,2023-04-11 15:31:39.466612,2023-04-11 15:31:50.522012,0 days 00:00:11.055400,True,9.002874427703068,gini,23,17,16,180,COMPLETE
42,42,0.7119790869485414,2023-04-11 15:31:50.524012,2023-04-11 15:32:03.289312,0 days 00:00:12.765300,True,7.187987921948713,gini,27,14,19,213,COMPLETE
43,43,0.7015963553686517,2023-04-11 15:32:03.292331,2023-04-11 15:32:16.176356,0 days 00:00:12.884025,True,7.177113281671277,gini,27,12,19,214,COMPLETE
44,44,0.6907466481534816,2023-04-11 15:32:16.178355,2023-04-11 15:32:30.143544,0 days 00:00:13.965189,True,6.660673907500681,gini,4,21,19,247,COMPLETE
45,45,0.695647869873466,2023-04-11 15:32:30.144545,2023-04-11 15:32:42.756582,0 days 00:00:12.612037,False,7.772042883576107,gini,30,10,19,200,COMPLETE
46,46,0.693527985630954,2023-04-11 15:32:42.758583,2023-04-11 15:32:55.231004,0 days 00:00:12.472421,True,5.848260073695966,entropy,26,18,15,219,COMPLETE
47,47,0.6956525247272148,2023-04-11 15:32:55.233003,2023-04-11 15:32:58.223263,0 days 00:00:02.990260,False,6.380914057990796,gini,29,14,17,55,COMPLETE
48,48,0.6437048119102637,2023-04-11 15:32:58.226246,2023-04-11 15:33:33.836217,0 days 00:00:35.609971,False,13.663370558999272,entropy,18,25,18,369,COMPLETE
49,49,0.661377414803156,2023-04-11 15:33:33.838218,2023-04-11 15:33:41.754072,0 days 00:00:07.915854,True,10.31186165745492,log_loss,21,8,11,176,COMPLETE
50,50,0.6984014446337179,2023-04-11 15:33:41.757074,2023-04-11 15:33:59.570322,0 days 00:00:17.813248,False,8.876474874694338,gini,26,18,16,247,COMPLETE
51,51,0.7024777185976349,2023-04-11 15:33:59.573305,2023-04-11 15:34:10.969377,0 days 00:00:11.396072,True,7.1335840282764345,gini,27,12,19,219,COMPLETE
52,52,0.6843693699236995,2023-04-11 15:34:10.972377,2023-04-11 15:34:25.689265,0 days 00:00:14.716888,True,7.394268968043639,gini,24,13,20,269,COMPLETE
53,53,0.7070661177275748,2023-04-11 15:34:25.691267,2023-04-11 15:34:37.386285,0 days 00:00:11.695018,True,8.118094143703301,gini,30,11,19,230,COMPLETE
54,54,0.6871134641859167,2023-04-11 15:34:37.389281,2023-04-11 15:34:49.738252,0 days 00:00:12.348971,True,6.873855564634839,gini,31,11,19,229,COMPLETE
55,55,0.7169975120086589,2023-04-11 15:34:49.740251,2023-04-11 15:35:06.734437,0 days 00:00:16.994186,True,7.981091335981691,gini,30,9,20,244,COMPLETE
56,56,0.705272761953822,2023-04-11 15:35:06.736438,2023-04-11 15:35:20.001961,0 days 00:00:13.265523,True,8.092253741715387,gini,32,6,20,296,COMPLETE
57,57,0.6983411727918093,2023-04-11 15:35:20.003959,2023-04-11 15:35:33.796018,0 days 00:00:13.792059,True,7.704019560197462,gini,32,5,20,309,COMPLETE
58,58,0.6855434303836703,2023-04-11 15:35:33.798014,2023-04-11 15:35:45.245169,0 days 00:00:11.447155,True,5.904485308209874,gini,30,3,20,293,COMPLETE
59,59,0.7009718399625074,2023-04-11 15:35:45.247180,2023-04-11 15:36:02.226513,0 days 00:00:16.979333,True,8.12177224202124,gini,30,8,20,350,COMPLETE
60,60,0.6802110770749956,2023-04-11 15:36:02.228495,2023-04-11 15:36:16.326545,0 days 00:00:14.098050,True,9.39351472296227,gini,29,6,19,311,COMPLETE
61,61,0.7096770650896567,2023-04-11 15:36:16.328546,2023-04-11 15:36:29.397560,0 days 00:00:13.069014,True,8.381472551454024,gini,32,9,18,265,COMPLETE
62,62,0.6872966497460657,2023-04-11 15:36:29.398560,2023-04-11 15:36:40.531671,0 days 00:00:11.133111,True,9.983019023508662,gini,32,9,18,241,COMPLETE
63,63,0.6995460525108502,2023-04-11 15:36:40.533671,2023-04-11 15:36:52.825099,0 days 00:00:12.291428,True,8.645607606540443,gini,31,9,20,261,COMPLETE
64,64,0.7002522527175499,2023-04-11 15:36:52.828082,2023-04-11 15:37:05.862369,0 days 00:00:13.034287,True,6.54912573314843,gini,29,6,17,289,COMPLETE
65,65,0.6728288081203798,2023-04-11 15:37:05.866351,2023-04-11 15:37:14.908522,0 days 00:00:09.042171,True,7.9235334227938825,gini,31,3,18,258,COMPLETE
66,66,0.706818116537874,2023-04-11 15:37:14.911505,2023-04-11 15:37:28.813441,0 days 00:00:13.901936,True,9.075892106263968,gini,32,10,19,277,COMPLETE
67,67,0.684074533960609,2023-04-11 15:37:28.815440,2023-04-11 15:37:43.774532,0 days 00:00:14.959092,True,8.883493459411678,gini,27,10,17,277,COMPLETE
68,68,0.7118694158448722,2023-04-11 15:37:43.777532,2023-04-11 15:37:54.786416,0 days 00:00:11.008884,True,9.579625492650244,gini,30,11,16,209,COMPLETE
69,69,0.6227077101545357,2023-04-11 15:37:54.788415,2023-04-11 15:38:04.333180,0 days 00:00:09.544765,True,9.360089557887733,log_loss,30,8,3,238,COMPLETE
70,70,0.6908510742370503,2023-04-11 15:38:04.335180,2023-04-11 15:38:14.693357,0 days 00:00:10.358177,True,10.91951876643863,gini,29,11,16,203,COMPLETE
71,71,0.6954997716341589,2023-04-11 15:38:14.696355,2023-04-11 15:38:29.553880,0 days 00:00:14.857525,True,7.192100492361937,gini,28,14,19,254,COMPLETE
72,72,0.6874866222953072,2023-04-11 15:38:29.557880,2023-04-11 15:38:42.286901,0 days 00:00:12.729021,True,10.213316642426673,gini,31,11,14,268,COMPLETE
73,73,0.695831339352114,2023-04-11 15:38:42.288901,2023-04-11 15:38:55.089930,0 days 00:00:12.801029,True,9.598237118526136,gini,32,13,18,229,COMPLETE
74,74,0.704277376043015,2023-04-11 15:38:55.091940,2023-04-11 15:39:11.164455,0 days 00:00:16.072515,True,8.403634650113887,gini,30,9,15,331,COMPLETE
75,75,0.6901764756287542,2023-04-11 15:39:11.166451,2023-04-11 15:39:22.094428,0 days 00:00:10.927977,True,9.119914336420726,gini,8,12,17,212,COMPLETE
76,76,0.6976581513632123,2023-04-11 15:39:22.096425,2023-04-11 15:39:35.565503,0 days 00:00:13.469078,True,7.476846968666605,log_loss,28,10,17,278,COMPLETE
77,77,0.7026930977120094,2023-04-11 15:39:35.568503,2023-04-11 15:39:44.238218,0 days 00:00:08.669715,True,9.796413313378945,gini,15,14,18,161,COMPLETE
78,78,0.6747508495405985,2023-04-11 15:39:44.241199,2023-04-11 15:39:52.078858,0 days 00:00:07.837659,True,8.416277682703369,gini,29,8,10,182,COMPLETE
79,79,0.705470719699133,2023-04-11 15:39:52.081857,2023-04-11 15:40:05.761233,0 days 00:00:13.679376,True,7.802201537422644,gini,25,13,16,240,COMPLETE
80,80,0.6704789358444463,2023-04-11 15:40:05.763232,2023-04-11 15:40:19.549398,0 days 00:00:13.786166,True,11.287822277472344,log_loss,12,7,19,302,COMPLETE
81,81,0.7151262744444469,2023-04-11 15:40:19.551398,2023-04-11 15:40:32.026916,0 days 00:00:12.475518,True,7.79289871569237,gini,24,12,15,234,COMPLETE
82,82,0.7024404541190622,2023-04-11 15:40:32.030916,2023-04-11 15:40:43.364082,0 days 00:00:11.333166,True,8.824681012005248,gini,24,11,14,222,COMPLETE
83,83,0.6916308367577433,2023-04-11 15:40:43.366083,2023-04-11 15:40:52.811717,0 days 00:00:09.445634,True,9.270292382095274,gini,27,10,13,195,COMPLETE
84,84,0.6887551927451758,2023-04-11 15:40:52.816717,2023-04-11 15:41:04.285751,0 days 00:00:11.469034,True,6.822499564025538,gini,26,12,15,209,COMPLETE
85,85,0.6949158831276595,2023-04-11 15:41:04.287752,2023-04-11 15:41:19.761570,0 days 00:00:15.473818,True,6.197016086199441,gini,31,15,16,249,COMPLETE
86,86,0.6951973973926208,2023-04-11 15:41:19.763566,2023-04-11 15:41:34.845100,0 days 00:00:15.081534,True,8.425846179211401,gini,32,17,18,234,COMPLETE
87,87,0.7066917520814068,2023-04-11 15:41:34.847102,2023-04-11 15:41:48.606114,0 days 00:00:13.759012,True,7.712562865423959,gini,25,9,19,269,COMPLETE
88,88,0.6920308103607934,2023-04-11 15:41:48.608099,2023-04-11 15:42:02.140905,0 days 00:00:13.532806,True,7.449051813839121,log_loss,29,9,19,264,COMPLETE
89,89,0.6988777686441534,2023-04-11 15:42:02.142912,2023-04-11 15:42:19.150261,0 days 00:00:17.007349,True,7.942846678488209,gini,28,11,19,278,COMPLETE
90,90,0.6995822088065786,2023-04-11 15:42:19.152263,2023-04-11 15:42:32.200305,0 days 00:00:13.048042,True,6.905856837279817,gini,25,7,20,253,COMPLETE
91,91,0.6918509566681474,2023-04-11 15:42:32.202306,2023-04-11 15:42:47.177263,0 days 00:00:14.974957,True,8.927838431598895,gini,30,12,17,272,COMPLETE
92,92,0.7055198119143206,2023-04-11 15:42:47.180240,2023-04-11 15:42:49.495426,0 days 00:00:02.315186,True,8.241502602220987,gini,22,10,12,36,COMPLETE
93,93,0.6774858716930741,2023-04-11 15:42:49.497426,2023-04-11 15:43:07.796942,0 days 00:00:18.299516,True,7.656754973163366,gini,24,13,15,319,COMPLETE
94,94,0.7135883838004843,2023-04-11 15:43:07.799940,2023-04-11 15:43:20.807836,0 days 00:00:13.007896,True,7.077237498352976,gini,25,9,18,225,COMPLETE
95,95,0.6933351064663322,2023-04-11 15:43:20.809835,2023-04-11 15:43:35.174888,0 days 00:00:14.365053,True,6.366803421324583,gini,27,8,18,285,COMPLETE
96,96,0.7001750437776942,2023-04-11 15:43:35.176893,2023-04-11 15:43:48.527947,0 days 00:00:13.351054,True,7.086227178682841,entropy,26,9,20,242,COMPLETE
97,97,0.6918665910560475,2023-04-11 15:43:48.529947,2023-04-11 15:44:00.697474,0 days 00:00:12.167527,True,7.910329583324417,gini,9,10,19,236,COMPLETE
98,98,0.6875747263256831,2023-04-11 15:44:00.700476,2023-04-11 15:44:06.300336,0 days 00:00:05.599860,True,5.126588354908439,gini,31,7,18,114,COMPLETE
99,99,0.690012117697434,2023-04-11 15:44:06.302349,2023-04-11 15:44:30.018043,0 days 00:00:23.715694,True,9.681631273472405,log_loss,30,11,19,396,COMPLETE
