,number,value,datetime_start,datetime_complete,duration,params_C,params_class_weight,params_gamma,params_kernel,state
0,0,0.5,2023-04-11 15:18:25.339619,2023-04-11 15:18:28.786917,0 days 00:00:03.447298,2.4479594580399175,2.856814907852479,7.035009125880776e-05,rbf,COMPLETE
1,1,0.6551498905245483,2023-04-11 15:18:28.788897,2023-04-11 15:18:33.472273,0 days 00:00:04.683376,21.191855082437595,12.277429980615574,0.007268024196585534,rbf,COMPLETE
2,2,0.6289998424184009,2023-04-11 15:18:33.474274,2023-04-11 15:18:37.858642,0 days 00:00:04.384368,60.84379445114651,13.806293835125091,0.0006851704140732289,rbf,COMPLETE
3,3,0.5,2023-04-11 15:18:37.860623,2023-04-11 15:18:39.511758,0 days 00:00:01.651135,0.0018411318380099316,2.1709215606120535,0.0002329193511962341,poly,COMPLETE
4,4,0.5,2023-04-11 15:18:39.513759,2023-04-11 15:18:45.687269,0 days 00:00:06.173510,0.05117430348065242,4.581067085872443,16.80573389025451,rbf,COMPLETE
5,5,0.5867072173504359,2023-04-11 15:18:45.691270,2023-04-11 15:18:57.174082,0 days 00:00:11.482812,28.209545968185143,17.293713408462814,12.326739351197723,poly,COMPLETE
6,6,0.5,2023-04-11 15:18:57.177084,2023-04-11 15:19:02.618627,0 days 00:00:05.441543,0.007296412641019207,14.388320092947191,0.31912862963581673,rbf,COMPLETE
7,7,0.5,2023-04-11 15:19:02.619645,2023-04-11 15:19:07.474066,0 days 00:00:04.854421,2.5086875165841096e-05,4.539912791664026,0.00016342759409128672,rbf,COMPLETE
8,8,0.5,2023-04-11 15:19:07.478078,2023-04-11 15:19:10.463325,0 days 00:00:02.985247,2.5667997016824224,14.683415676618743,8.412727126878442e-05,poly,COMPLETE
9,9,0.5,2023-04-11 15:19:10.465325,2023-04-11 15:19:16.068756,0 days 00:00:05.603431,1.0452225912997286,19.218431124621436,4.640677624176718,rbf,COMPLETE
10,10,0.6704818552520866,2023-04-11 15:19:16.070756,2023-04-11 15:19:19.701058,0 days 00:00:03.630302,74.64658978675111,9.210325398921938,0.006752610939873167,sigmoid,COMPLETE
11,11,0.6769638373442997,2023-04-11 15:19:19.703074,2023-04-11 15:19:22.941336,0 days 00:00:03.238262,81.63356787003002,9.130496499191862,0.009011007043004636,sigmoid,COMPLETE
12,12,0.6597991320327423,2023-04-11 15:19:22.943337,2023-04-11 15:19:25.546543,0 days 00:00:02.603206,92.69742023121005,8.246789710280607,0.01450718665418045,sigmoid,COMPLETE
13,13,0.5968154751318131,2023-04-11 15:19:25.547543,2023-04-11 15:19:31.014987,0 days 00:00:05.467444,0.3789155973398855,9.132705667296008,0.12770684906959215,sigmoid,COMPLETE
14,14,0.6887875191520092,2023-04-11 15:19:31.018964,2023-04-11 15:19:34.425260,0 days 00:00:03.406296,9.26992256142215,7.684833491052077,0.0039628364899805535,sigmoid,COMPLETE
15,15,0.6785637034856385,2023-04-11 15:19:34.427237,2023-04-11 15:19:37.963539,0 days 00:00:03.536302,7.251638943045795,6.985272401651695,0.0010665954610882794,sigmoid,COMPLETE
16,16,0.5,2023-04-11 15:19:37.965524,2023-04-11 15:19:41.830830,0 days 00:00:03.865306,5.897890947178163,6.681621376618866,1.2911655591595121e-05,sigmoid,COMPLETE
17,17,0.5,2023-04-11 15:19:41.832849,2023-04-11 15:19:45.558148,0 days 00:00:03.725299,0.1443863433069117,6.78538015827751,0.0008865383097240319,sigmoid,COMPLETE
18,18,0.5465383918352409,2023-04-11 15:19:45.560149,2023-04-11 15:19:49.368956,0 days 00:00:03.808807,4.67654545595497,11.363946533489944,0.001064714197857516,sigmoid,COMPLETE
19,19,0.6476227842349239,2023-04-11 15:19:49.370957,2023-04-11 15:19:54.013867,0 days 00:00:04.642910,0.6799779033606264,6.398770824426017,0.0942191340512838,sigmoid,COMPLETE
20,20,0.5,2023-04-11 15:19:54.016866,2023-04-11 15:19:56.111308,0 days 00:00:02.094442,8.940015384283813,1.3612562152454952,0.0015041868662840551,sigmoid,COMPLETE
21,21,0.6798395238284174,2023-04-11 15:19:56.113313,2023-04-11 15:19:59.830591,0 days 00:00:03.717278,13.80572170444131,9.985023186869041,0.006698770733828163,sigmoid,COMPLETE
22,22,0.6648813765034347,2023-04-11 15:19:59.833591,2023-04-11 15:20:03.462964,0 days 00:00:03.629373,10.813449557460384,10.651100723061306,0.0030912861486031046,sigmoid,COMPLETE
23,23,0.6840230297953558,2023-04-11 15:20:03.465965,2023-04-11 15:20:06.834998,0 days 00:00:03.369033,1.6687707112333676,7.814473432570203,0.017021359878976763,sigmoid,COMPLETE
24,24,0.6675846678893198,2023-04-11 15:20:06.836980,2023-04-11 15:20:10.322276,0 days 00:00:03.485296,1.8706601455995502,10.466128933081695,0.04578662630874326,sigmoid,COMPLETE
25,25,0.6609980512255295,2023-04-11 15:20:10.324256,2023-04-11 15:20:13.624521,0 days 00:00:03.300265,0.29526779832085465,8.089924708186512,0.029804516333286082,sigmoid,COMPLETE
26,26,0.5939650350923265,2023-04-11 15:20:13.626522,2023-04-11 15:20:23.451354,0 days 00:00:09.824832,20.008080554085755,5.0574672435888886,0.4359456797602292,poly,COMPLETE
27,27,0.5709655178649052,2023-04-11 15:20:23.453355,2023-04-11 15:20:27.264317,0 days 00:00:03.810962,1.8135815764476613,11.926935697184655,0.0038467293575456486,sigmoid,COMPLETE
28,28,0.6681640986154224,2023-04-11 15:20:27.268300,2023-04-11 15:20:30.797340,0 days 00:00:03.529040,0.7878839965711434,10.208619591302396,0.020760577194970202,sigmoid,COMPLETE
29,29,0.6692475942373705,2023-04-11 15:20:30.800340,2023-04-11 15:20:33.508605,0 days 00:00:02.708265,3.255408255950816,3.348929157045033,0.003008197509296037,sigmoid,COMPLETE
30,30,0.5956687500132972,2023-04-11 15:20:33.510607,2023-04-11 15:20:44.535490,0 days 00:00:11.024883,0.15719578151357846,8.231205277755217,79.90674527128193,poly,COMPLETE
31,31,0.6519449007891002,2023-04-11 15:20:44.537490,2023-04-11 15:20:47.903784,0 days 00:00:03.366294,7.102594790126957,7.535872626738243,0.00046378639265857156,sigmoid,COMPLETE
32,32,0.715626499245406,2023-04-11 15:20:47.905782,2023-04-11 15:20:51.070053,0 days 00:00:03.164271,13.33409554579792,5.667583142661401,0.0019447586825862282,sigmoid,COMPLETE
33,33,0.6958813352118877,2023-04-11 15:20:51.072039,2023-04-11 15:20:53.724249,0 days 00:00:02.652210,27.269776628743873,5.008436146346789,0.005688585023003004,sigmoid,COMPLETE
34,34,0.7059105179696046,2023-04-11 15:20:53.726248,2023-04-11 15:20:56.911503,0 days 00:00:03.185255,15.411883931475623,5.617996589034441,0.0003514269997022349,sigmoid,COMPLETE
35,35,0.700457370477425,2023-04-11 15:20:56.913503,2023-04-11 15:20:59.835407,0 days 00:00:02.921904,20.345458403074556,5.885782144232493,0.00040055046313842475,sigmoid,COMPLETE
36,36,0.7117937102549725,2023-04-11 15:20:59.838407,2023-04-11 15:21:02.496622,0 days 00:00:02.658215,29.759246342434146,5.559371935010867,0.0003403453206185702,sigmoid,COMPLETE
37,37,0.667538938224334,2023-04-11 15:21:02.498623,2023-04-11 15:21:05.847689,0 days 00:00:03.349066,40.30125124618426,3.1226307322511753,0.00036424858438444894,rbf,COMPLETE
38,38,0.5,2023-04-11 15:21:05.850689,2023-04-11 15:21:08.719438,0 days 00:00:02.868749,35.22681379148894,5.732317900144905,0.00021873715401875285,poly,COMPLETE
39,39,0.656038425175583,2023-04-11 15:21:08.721438,2023-04-11 15:21:13.556826,0 days 00:00:04.835388,21.311925654587736,4.019671353925972,7.890228845506307e-05,rbf,COMPLETE
40,40,0.5,2023-04-11 15:21:13.559828,2023-04-11 15:21:16.317066,0 days 00:00:02.757238,23.485452530980474,2.247649545699346,0.00013782808342383083,sigmoid,COMPLETE
41,41,0.6963011908299817,2023-04-11 15:21:16.319051,2023-04-11 15:21:20.175868,0 days 00:00:03.856817,42.26059412321998,5.479901971813778,0.0004970708917611858,sigmoid,COMPLETE
42,42,0.7000760617659205,2023-04-11 15:21:20.179868,2023-04-11 15:21:23.762662,0 days 00:00:03.582794,46.48682676442412,5.731371819678045,0.00036589043267150464,sigmoid,COMPLETE
43,43,0.6633187179520995,2023-04-11 15:21:23.765663,2023-04-11 15:21:26.998921,0 days 00:00:03.233258,58.93538334627674,4.214839820093921,5.221357727457501e-05,sigmoid,COMPLETE
44,44,0.6958998810171086,2023-04-11 15:21:27.000921,2023-04-11 15:21:30.389198,0 days 00:00:03.388277,85.53906820544434,5.98536617849817,0.0002765702327327594,sigmoid,COMPLETE
45,45,0.5,2023-04-11 15:21:30.393193,2023-04-11 15:21:33.221418,0 days 00:00:02.828225,3.9151663199740114,3.870962240973263,0.0016721347365224613,poly,COMPLETE
46,46,0.6884226674950921,2023-04-11 15:21:33.224420,2023-04-11 15:21:37.776721,0 days 00:00:04.552301,14.538554963917262,5.42378988002146,0.00041139695195976207,rbf,COMPLETE
47,47,0.7202577335159238,2023-04-11 15:21:37.779702,2023-04-11 15:21:40.906436,0 days 00:00:03.126734,46.74401881514712,4.679846911573694,0.0007559000458962862,sigmoid,COMPLETE
48,48,0.6958476352087597,2023-04-11 15:21:40.908456,2023-04-11 15:21:43.640655,0 days 00:00:02.732199,16.15620357528616,4.532650582297782,0.0019541545801801093,sigmoid,COMPLETE
49,49,0.6797238824576616,2023-04-11 15:21:43.642654,2023-04-11 15:21:46.380539,0 days 00:00:02.737885,89.97853990220537,3.2238568925879107,0.0006636390279782347,sigmoid,COMPLETE
50,50,0.5,2023-04-11 15:21:46.382526,2023-04-11 15:21:48.822719,0 days 00:00:02.440193,3.462637176455363,2.3067865509070695,0.00011880679979869136,sigmoid,COMPLETE
51,51,0.7000737300699702,2023-04-11 15:21:48.824717,2023-04-11 15:21:52.044974,0 days 00:00:03.220257,41.61539864760938,6.11898538857163,0.0007737353417314762,sigmoid,COMPLETE
52,52,0.6901912763645409,2023-04-11 15:21:52.049980,2023-04-11 15:21:55.244232,0 days 00:00:03.194252,48.13621892965711,4.849736116493015,0.00022814615322293806,sigmoid,COMPLETE
53,53,0.5,2023-04-11 15:21:55.245249,2023-04-11 15:21:59.076558,0 days 00:00:03.831309,6.9649107750078665,6.9768543040215265,4.9802508636002344e-05,sigmoid,COMPLETE
54,54,0.6909618614350317,2023-04-11 15:21:59.078542,2023-04-11 15:22:02.703831,0 days 00:00:03.625289,13.325943453734931,6.439210227456112,0.001209917890822304,sigmoid,COMPLETE
55,55,0.7048292578771541,2023-04-11 15:22:02.705831,2023-04-11 15:22:06.058118,0 days 00:00:03.352287,27.115209379871878,5.283318705885861,0.00025390580354388124,sigmoid,COMPLETE
56,56,0.5490001325178414,2023-04-11 15:22:06.061099,2023-04-11 15:22:10.264690,0 days 00:00:04.203591,5.374535284624791,3.9238958193118814,0.00016170959640261128,rbf,COMPLETE
57,57,0.6887524282208412,2023-04-11 15:22:10.267688,2023-04-11 15:22:13.286932,0 days 00:00:03.019244,95.11011446265374,7.128635002038077,0.0020651099169706495,sigmoid,COMPLETE
58,58,0.7146325370857506,2023-04-11 15:22:13.288931,2023-04-11 15:22:16.134855,0 days 00:00:02.845924,24.605848585126413,4.779195589964301,0.0007080317011145997,sigmoid,COMPLETE
59,59,0.6896088724209697,2023-04-11 15:22:16.137856,2023-04-11 15:22:19.180585,0 days 00:00:03.042729,12.831687157341793,4.769458763647664,0.0011173414567029942,sigmoid,COMPLETE
60,60,0.5,2023-04-11 15:22:19.183597,2023-04-11 15:22:21.049753,0 days 00:00:01.866156,28.544350584377042,1.1334537012384418,0.0007363940302145819,sigmoid,COMPLETE
61,61,0.6922808454563872,2023-04-11 15:22:21.052736,2023-04-11 15:22:24.361018,0 days 00:00:03.308282,8.603452952255195,6.206824382753383,0.0006585977544141334,sigmoid,COMPLETE
62,62,0.7054259108484384,2023-04-11 15:22:24.363003,2023-04-11 15:22:27.681264,0 days 00:00:03.318261,20.15994806517018,5.1764234851479,0.00023311795565605922,sigmoid,COMPLETE
63,63,0.5159259789054471,2023-04-11 15:22:27.685266,2023-04-11 15:22:31.362563,0 days 00:00:03.677297,4.960444066756324,5.203053862473252,0.00010312319245018305,sigmoid,COMPLETE
64,64,0.6460473281638127,2023-04-11 15:22:31.364562,2023-04-11 15:22:34.721829,0 days 00:00:03.357267,58.45874424182422,4.33237423283841,2.976905701513678e-05,sigmoid,COMPLETE
65,65,0.5,2023-04-11 15:22:34.723831,2023-04-11 15:22:36.765992,0 days 00:00:02.042161,10.843204119485401,3.578056681273625,0.00021401077354151843,poly,COMPLETE
66,66,0.5,2023-04-11 15:22:36.766994,2023-04-11 15:22:39.397783,0 days 00:00:02.630789,2.382225364884709,2.7621679803836954,0.00012522180475008126,sigmoid,COMPLETE
67,67,0.6766804398379922,2023-04-11 15:22:39.399782,2023-04-11 15:22:43.244992,0 days 00:00:03.845210,26.83503728265553,7.277729419540362,0.00025951015298787065,sigmoid,COMPLETE
68,68,0.6708744342193503,2023-04-11 15:22:43.247991,2023-04-11 15:22:46.654951,0 days 00:00:03.406960,1.114867144003953,4.541440125327441,0.002048250660019232,sigmoid,COMPLETE
69,69,0.6728858623883371,2023-04-11 15:22:46.656948,2023-04-11 15:22:49.800198,0 days 00:00:03.143250,99.88157893042937,3.6404876031186895,0.0005929850967182459,sigmoid,COMPLETE
70,70,0.6897095535594306,2023-04-11 15:22:49.802198,2023-04-11 15:22:52.952450,0 days 00:00:03.150252,20.244151203655147,6.622151434456125,0.0012494207391349297,sigmoid,COMPLETE
71,71,0.7095384733021366,2023-04-11 15:22:52.955451,2023-04-11 15:22:56.189763,0 days 00:00:03.234312,27.698690809815883,5.492183422194119,0.00042062190643597146,sigmoid,COMPLETE
72,72,0.6900281395853293,2023-04-11 15:22:56.191763,2023-04-11 15:22:59.400018,0 days 00:00:03.208255,31.472804117751117,5.276304796139412,0.00017116846890794085,sigmoid,COMPLETE
73,73,0.684636468596821,2023-04-11 15:22:59.402020,2023-04-11 15:23:03.259330,0 days 00:00:03.857310,55.33487105750527,8.616380194784977,0.0002909714723987884,sigmoid,COMPLETE
74,74,0.7011514141482702,2023-04-11 15:23:03.262336,2023-04-11 15:23:07.435669,0 days 00:00:04.173333,9.477916134973109,4.931206672025609,0.0008373776924119133,sigmoid,COMPLETE
75,75,0.6900102864937425,2023-04-11 15:23:07.437663,2023-04-11 15:23:11.287974,0 days 00:00:03.850311,16.829712969245975,6.612187718903448,0.0004741148722742724,sigmoid,COMPLETE
76,76,0.695843822242212,2023-04-11 15:23:11.289975,2023-04-11 15:23:15.454307,0 days 00:00:04.164332,32.90121524188969,7.521759106484063,0.00333851811007987,rbf,COMPLETE
77,77,0.6058526531081382,2023-04-11 15:23:15.459308,2023-04-11 15:23:19.776163,0 days 00:00:04.316855,6.5974256552240105,5.614503908471045,7.656726284798726e-05,sigmoid,COMPLETE
78,78,0.5,2023-04-11 15:23:19.777165,2023-04-11 15:23:22.492960,0 days 00:00:02.715795,70.33907269936984,4.29941220793092,0.00030401162891091654,poly,COMPLETE
79,79,0.6674175127411329,2023-04-11 15:23:22.494959,2023-04-11 15:23:25.079257,0 days 00:00:02.584298,2.84864759283721,2.87047705063,0.008612283737700146,sigmoid,COMPLETE
80,80,0.6859739705716581,2023-04-11 15:23:25.081257,2023-04-11 15:23:29.038213,0 days 00:00:03.956956,18.55109697448846,5.3777775639591345,0.0001630365359791287,sigmoid,COMPLETE
81,81,0.6991280565460529,2023-04-11 15:23:29.040213,2023-04-11 15:23:32.012974,0 days 00:00:02.972761,10.26069367594826,4.681604588957724,0.0010156166812259379,sigmoid,COMPLETE
82,82,0.6866398375519318,2023-04-11 15:23:32.014977,2023-04-11 15:23:35.341242,0 days 00:00:03.326265,9.288272423687092,6.075567769679914,0.0006428863137019491,sigmoid,COMPLETE
83,83,0.6927086216521856,2023-04-11 15:23:35.344241,2023-04-11 15:23:38.218473,0 days 00:00:02.874232,29.89328686202913,4.880528544411692,0.00038177385373607296,sigmoid,COMPLETE
84,84,0.6944166714400068,2023-04-11 15:23:38.220474,2023-04-11 15:23:41.047702,0 days 00:00:02.827228,58.799868993705886,4.0380712296132755,0.0009888093880610282,sigmoid,COMPLETE
85,85,0.6851207889819121,2023-04-11 15:23:41.050702,2023-04-11 15:23:44.364985,0 days 00:00:03.314283,4.9872132291565485,5.829548646263849,0.0015784372855575527,sigmoid,COMPLETE
86,86,0.6985947846035151,2023-04-11 15:23:44.366983,2023-04-11 15:23:47.510218,0 days 00:00:03.143235,21.20545474118789,6.848060381945997,0.0005495248583672366,sigmoid,COMPLETE
87,87,0.6895499033747257,2023-04-11 15:23:47.511220,2023-04-11 15:23:49.991148,0 days 00:00:02.479928,35.22107512053336,3.501080280005136,0.002470642997533494,sigmoid,COMPLETE
88,88,0.7017159504408366,2023-04-11 15:23:49.993148,2023-04-11 15:23:53.519434,0 days 00:00:03.526286,13.405658375874767,5.087119704406464,0.00020225228554313825,sigmoid,COMPLETE
89,89,0.6876355146850333,2023-04-11 15:23:53.521432,2023-04-11 15:23:58.120337,0 days 00:00:04.598905,16.610351962428247,6.241510013504877,0.00021543199622547853,rbf,COMPLETE
90,90,0.6503415566530704,2023-04-11 15:23:58.122334,2023-04-11 15:24:01.767625,0 days 00:00:03.645291,13.350569110515355,5.302059898140231,5.8923521680117614e-05,sigmoid,COMPLETE
91,91,0.6752118055742587,2023-04-11 15:24:01.768625,2023-04-11 15:24:05.073890,0 days 00:00:03.305265,8.271794655025767,5.11226872945636,0.0003644282826498743,sigmoid,COMPLETE
92,92,0.6977166566658466,2023-04-11 15:24:05.075892,2023-04-11 15:24:07.926123,0 days 00:00:02.850231,47.33315808039829,4.393858636896735,0.0008764160589616729,sigmoid,COMPLETE
93,93,0.5125287493303083,2023-04-11 15:24:07.928120,2023-04-11 15:24:11.535409,0 days 00:00:03.607289,3.8889435515227215,5.710760624726048,9.49643370386587e-05,sigmoid,COMPLETE
94,94,0.7005652378962249,2023-04-11 15:24:11.537410,2023-04-11 15:24:14.435201,0 days 00:00:02.897791,26.13392952631471,4.851185696273835,0.001430551490848189,sigmoid,COMPLETE
95,95,0.6032477996678283,2023-04-11 15:24:14.439200,2023-04-11 15:24:17.712461,0 days 00:00:03.273261,11.51045784863086,3.9962272482086942,0.0001717635288637507,sigmoid,COMPLETE
96,96,0.6766569653684534,2023-04-11 15:24:17.715462,2023-04-11 15:24:20.685608,0 days 00:00:02.970146,45.80767209320524,6.309998630204403,0.004758055800859466,poly,COMPLETE
97,97,0.6958578467864683,2023-04-11 15:24:20.689611,2023-04-11 15:24:24.330901,0 days 00:00:03.641290,5.1506859223944765,5.682706430015446,0.0005004323797391752,sigmoid,COMPLETE
98,98,0.6895034021001141,2023-04-11 15:24:24.334900,2023-04-11 15:24:27.913953,0 days 00:00:03.579053,22.046499206643908,5.124180973946849,0.0002758887473376187,sigmoid,COMPLETE
99,99,0.712031624691088,2023-04-11 15:24:27.915955,2023-04-11 15:24:31.339713,0 days 00:00:03.423758,7.26121940530595,4.5297150931595995,0.0008314455235198938,sigmoid,COMPLETE
