,number,value,datetime_start,datetime_complete,duration,params_alpha,params_booster,params_colsample_bytree,params_eta,params_gamma,params_grow_policy,params_lambda,params_max_depth,params_min_child_weight,params_normalize_type,params_rate_drop,params_sample_type,params_skip_drop,params_subsample,state
76,76,0.6110656247430306,2023-04-11 16:56:12.548525,2023-04-11 16:56:16.289828,0 days 00:00:03.741303,1.0793357689402487e-07,gbtree,0.7851783599250298,0.1326663900104551,0.001693150429808385,depthwise,3.1952857681149954e-08,4,4,,,,,0.6545046451694574,COMPLETE
77,77,0.6244604371031273,2023-04-11 16:56:16.293831,2023-04-11 16:56:20.761762,0 days 00:00:04.467931,2.310225577340014e-07,gbtree,0.8227315445509156,0.2128245133539913,0.009403261986966392,depthwise,1.0022754882406528e-07,4,7,,,,,0.7067280278081115,COMPLETE
78,78,0.6057879915853499,2023-04-11 16:56:20.766763,2023-04-11 16:56:24.479830,0 days 00:00:03.713067,6.33621359866029e-07,gbtree,0.8849974255853013,0.04007471520902366,0.0035570434449226007,depthwise,1.846127229094712e-07,4,6,,,,,0.7161838695700907,COMPLETE
79,79,0.6257457284926546,2023-04-11 16:56:24.484831,2023-04-11 16:56:27.543834,0 days 00:00:03.059003,2.1857482357646813e-07,gbtree,0.8549291106164585,0.241776421634193,0.009296988261231,depthwise,8.195931787910366e-08,3,7,,,,,0.7022934720949331,COMPLETE
80,80,0.6048531235627369,2023-04-11 16:56:27.547834,2023-04-11 16:56:30.486193,0 days 00:00:02.938359,1.8999476076345626e-07,gbtree,0.8514418835814477,0.21564295444363363,0.007128374827577177,depthwise,8.706265208419726e-08,3,7,,,,,0.6798171841141102,COMPLETE
81,81,0.6065357999471457,2023-04-11 16:56:30.491195,2023-04-11 16:56:33.863211,0 days 00:00:03.372016,3.9886755807713026e-08,gbtree,0.8002858910929143,0.07417581308204492,0.007776103860471173,depthwise,1.088315068663849e-07,4,7,,,,,0.7036177475849974,COMPLETE
82,82,0.6154448556775491,2023-04-11 16:56:33.867213,2023-04-11 16:56:36.750018,0 days 00:00:02.882805,1.9318665756892571e-07,gbtree,0.8740518890869357,0.23854928896358946,0.010872819745548604,depthwise,5.601291596128755e-08,3,6,,,,,0.6381856439864466,COMPLETE
83,83,0.6194486034597321,2023-04-11 16:56:36.755019,2023-04-11 16:56:39.559051,0 days 00:00:02.804032,5.056316569767282e-07,gbtree,0.7551547657710108,0.14234801280683826,0.021306905485967968,depthwise,1.0745278158275186e-08,3,5,,,,,0.7324700702202307,COMPLETE
84,84,0.6218493343621921,2023-04-11 16:56:39.564052,2023-04-11 16:56:43.387145,0 days 00:00:03.823093,9.883318882334758e-08,gbtree,0.927043398059144,0.2820439969957458,0.002069703085710225,depthwise,3.3193374781289147e-08,3,7,,,,,0.6873905801040878,COMPLETE
85,85,0.6228326091631281,2023-04-11 16:56:43.393144,2023-04-11 16:56:47.474014,0 days 00:00:04.080870,9.002409444647787e-07,gbtree,0.8280788027353188,0.0597581701859049,0.004962801463371208,depthwise,1.543696859458128e-07,4,6,,,,,0.6614761941691489,COMPLETE
86,86,0.6179373802112543,2023-04-11 16:56:47.478016,2023-04-11 16:56:51.505921,0 days 00:00:04.027905,2.509711042571724e-07,gbtree,0.8968037673369401,0.09831744159666023,0.0029448627798311145,depthwise,8.003062622115555e-08,4,7,,,,,0.7061147723215206,COMPLETE
87,87,0.6025151000739185,2023-04-11 16:56:51.509920,2023-04-11 16:56:55.345412,0 days 00:00:03.835492,4.068171934516928e-08,gbtree,0.7261940616645468,0.035835619148054006,0.007818827272921264,depthwise,2.6152400542379493e-07,3,6,,,,,0.6298031985456894,COMPLETE
88,88,0.6166858325011125,2023-04-11 16:56:55.349411,2023-04-11 16:56:59.232322,0 days 00:00:03.882911,2.838036060475294e-06,gbtree,0.8546137612747959,0.6913680921101661,0.000599934097602297,depthwise,5.339862427708027e-07,3,7,,,,,0.6230129971242435,COMPLETE
89,89,0.6183390671517971,2023-04-11 16:56:59.236323,2023-04-11 16:57:02.614593,0 days 00:00:03.378270,1.3403029591534027e-06,gbtree,0.7862380165429053,0.29159214700901487,0.00026899014689205796,depthwise,4.470321727337764e-08,4,8,,,,,0.7412645041985895,COMPLETE
90,90,0.6228130109136905,2023-04-11 16:57:02.618595,2023-04-11 16:57:05.248863,0 days 00:00:02.630268,5.67999921339647e-07,gbtree,0.8165093970700924,0.1390803249462923,0.0006156158592855734,depthwise,2.0622364816359703e-07,2,5,,,,,0.7882958244494751,COMPLETE
91,91,0.6154824866857889,2023-04-11 16:57:05.252864,2023-04-11 16:57:08.814434,0 days 00:00:03.561570,1.0154143868897985e-06,gbtree,0.8325180356878829,0.06602551419423396,0.005180985080788886,depthwise,1.4477788717440706e-07,4,6,,,,,0.6606189825037051,COMPLETE
92,92,0.6235103011989933,2023-04-11 16:57:08.818436,2023-04-11 16:57:12.444234,0 days 00:00:03.625798,8.78716753237462e-07,gbtree,0.87628850583282,0.36659470668647126,0.0001645174886864763,depthwise,6.710586702845043e-08,3,6,,,,,0.6741147225334793,COMPLETE
93,93,0.6064383987735639,2023-04-11 16:57:12.449235,2023-04-11 16:57:15.618033,0 days 00:00:03.168798,2.4805147597513795e-07,gbtree,0.8775520653454776,0.3869222677724399,0.00014760153230904607,depthwise,6.066568186586261e-08,3,6,,,,,0.6835947234904273,COMPLETE
94,94,0.6170144557210658,2023-04-11 16:57:15.622035,2023-04-11 16:57:18.658780,0 days 00:00:03.036745,1.8394621839969955e-06,gbtree,0.9113471881956889,0.20599611839407259,0.0003881342670776816,depthwise,2.7387348725883487e-08,3,7,,,,,0.6482371602789492,COMPLETE
95,95,0.6079695290309816,2023-04-11 16:57:18.662782,2023-04-11 16:57:21.268230,0 days 00:00:02.605448,4.886251699732342e-07,gbtree,0.8523572966352767,0.9905433140415011,0.0016511248278463643,depthwise,9.454322003324956e-08,2,7,,,,,0.7127585504578309,COMPLETE
96,96,0.6206093641396783,2023-04-11 16:57:21.273231,2023-04-11 16:57:24.669134,0 days 00:00:03.395903,1.3935207631290665e-07,gbtree,0.7891440534495471,0.37104769394552856,0.00017118623575076376,depthwise,1.417545132169375e-08,3,6,,,,,0.7466790469059464,COMPLETE
97,97,0.6148598691504643,2023-04-11 16:57:24.673135,2023-04-11 16:57:27.778386,0 days 00:00:03.105251,3.4660082065719037e-07,gbtree,0.762728587412471,0.7024985432679766,0.00027527813337132977,depthwise,3.738467129865579e-08,3,5,,,,,0.7220314511061778,COMPLETE
98,98,0.6309333314049619,2023-04-11 16:57:27.782386,2023-04-11 16:57:30.548693,0 days 00:00:02.766307,7.549547969641243e-07,gbtree,0.813136096313624,0.20992418349293265,0.0005245302485386222,depthwise,4.3142691259505993e-07,2,7,,,,,0.6738654478509913,COMPLETE
99,99,0.620367365132703,2023-04-11 16:57:30.552694,2023-04-11 16:57:33.912052,0 days 00:00:03.359358,6.471961915009813e-07,gbtree,0.7231971389647085,0.11121420771932385,0.002567475383256345,depthwise,4.1596400666007356e-07,2,8,,,,,0.587403978983419,COMPLETE
