,number,value,datetime_start,datetime_complete,duration,params_alpha,params_booster,params_colsample_bytree,params_eta,params_gamma,params_grow_policy,params_lambda,params_max_depth,params_min_child_weight,params_normalize_type,params_rate_drop,params_sample_type,params_skip_drop,params_subsample,state
0,0,0.7157495920453492,2023-04-10 20:05:13.501900,2023-04-10 20:05:45.825528,0 days 00:00:32.323628,2.558093330608396e-07,dart,0.5793498697193393,0.0001380693327315852,1.3435246631297582e-07,depthwise,2.8498996326576875e-07,7,4,forest,0.0006703622276892519,uniform,8.756227987766684e-06,0.30014484313588863,COMPLETE
1,1,0.73821207388334,2023-04-10 20:05:45.827529,2023-04-10 20:05:47.534670,0 days 00:00:01.707141,7.64540230148692e-06,gbtree,0.29158544095969585,0.016826323820493913,0.05513688425417915,lossguide,0.00029762551423984237,5,2,,,,,0.3621257783378582,COMPLETE
2,2,0.7325120821132745,2023-04-10 20:05:47.538669,2023-04-10 20:05:49.011789,0 days 00:00:01.473120,8.262669432951545e-08,gbtree,0.20233021143631938,0.12151416907598511,3.5742261708304013e-06,lossguide,0.6652094456128205,7,2,,,,,0.39004859464274366,COMPLETE
3,3,0.7148544887036742,2023-04-10 20:05:49.014788,2023-04-10 20:06:18.659201,0 days 00:00:29.644413,0.42086576815172017,dart,0.7826190174929726,4.646869212809334e-05,1.8367482649488671e-07,depthwise,0.0021303036666249025,1,6,tree,0.01664762452959757,weighted,0.10820164915312828,0.6544746633461269,COMPLETE
4,4,0.7192292910656416,2023-04-10 20:06:18.661201,2023-04-10 20:06:20.054315,0 days 00:00:01.393114,0.00030248337714491673,gbtree,0.5994481229997419,2.9681615849554078e-08,0.28568381366238055,lossguide,5.1294602437773955e-06,3,6,,,,,0.9712777108453801,COMPLETE
5,5,0.7548139730344803,2023-04-10 20:06:20.057315,2023-04-10 20:06:36.988694,0 days 00:00:16.931379,0.02605792117510153,dart,0.39739250577050056,0.3113825757070927,1.9089082910479185e-08,depthwise,0.0020249607512954062,9,5,tree,0.4996654665948402,uniform,0.09729089991445154,0.5355510899562601,COMPLETE
6,6,0.7240679180198674,2023-04-10 20:06:36.991693,2023-04-10 20:07:05.678029,0 days 00:00:28.686336,1.2857567590263215e-07,dart,0.5053410625064172,4.274637980202991e-05,2.1805504253299854e-08,depthwise,1.1006621386990643e-07,3,2,tree,1.0383537233125763e-07,uniform,0.00011741574776260685,0.7371632828427661,COMPLETE
7,7,0.7268218160321379,2023-04-10 20:07:05.680029,2023-04-10 20:07:07.258158,0 days 00:00:01.578129,0.058114107145505176,gbtree,0.7040120827472105,0.005026737381771468,5.0842043701092636e-05,lossguide,1.3154427583821448e-07,7,6,,,,,0.20991165576463217,COMPLETE
8,8,0.70472118619532,2023-04-10 20:07:07.260157,2023-04-10 20:07:09.048302,0 days 00:00:01.788145,8.667454329557166e-07,gbtree,0.5445348325286627,0.0016285975424960527,3.3319744811487823e-06,lossguide,1.9870470721990217e-08,6,10,,,,,0.42032230043714647,COMPLETE
9,9,0.7185250080043404,2023-04-10 20:07:09.051303,2023-04-10 20:07:35.712473,0 days 00:00:26.661170,1.878730543481114e-05,dart,0.4308871721350482,1.634275488546585e-08,3.07289777343673e-06,depthwise,0.05461079662619784,9,7,tree,0.002330458042358787,uniform,8.79669194681605e-05,0.23964665443659064,COMPLETE
10,10,0.730680510315286,2023-04-10 20:07:35.715473,2023-04-10 20:08:02.959690,0 days 00:00:27.244217,0.00621152338077866,dart,0.9797699706877061,0.2459432573847781,0.0021056709320238765,depthwise,3.92056833187008e-05,9,9,forest,0.4069450357665642,weighted,0.7976701076209144,0.5226689655971197,COMPLETE
11,11,0.7063618476099587,2023-04-10 20:08:02.961691,2023-04-10 20:08:04.443811,0 days 00:00:01.482120,0.0003521747441341471,gbtree,0.3343984912830862,0.7921315098997168,0.006618297042780852,lossguide,0.0007620646542928395,4,4,,,,,0.5120613767261509,COMPLETE
12,12,0.7271951363413311,2023-04-10 20:08:04.446812,2023-04-10 20:08:16.556798,0 days 00:00:12.109986,1.3228771507573625e-05,dart,0.3167137881266898,0.028153670952607242,1.0112672499649334e-08,lossguide,0.0024390732588779893,5,4,tree,0.6807675448650377,uniform,4.956460858940679e-08,0.37210125899394386,COMPLETE
13,13,0.6886072990922598,2023-04-10 20:08:16.558798,2023-04-10 20:08:18.281938,0 days 00:00:01.723140,0.005947380243828627,gbtree,0.4017270304740017,0.5633334953459804,0.9013006001709425,depthwise,9.853008253535773e-05,5,3,,,,,0.5051565277613053,COMPLETE
14,14,0.730664369937853,2023-04-10 20:08:18.283938,2023-04-10 20:08:19.739057,0 days 00:00:01.455119,0.9432052313422917,gbtree,0.20187016537959634,0.02616847613435013,0.0012480700028564377,lossguide,0.005634454624555605,8,8,,,,,0.6345194694318742,COMPLETE
15,15,0.6873233092861125,2023-04-10 20:08:19.741057,2023-04-10 20:08:50.031523,0 days 00:00:30.290466,1.1779501392232572e-08,dart,0.31743962451577146,0.9720492806897367,0.06275101041675137,depthwise,1.3809866563528004e-05,1,5,tree,1.3406769225989715e-05,uniform,0.014580711276009068,0.3100547405974824,COMPLETE
16,16,0.7562534834563915,2023-04-10 20:08:50.033523,2023-04-10 20:08:51.573648,0 days 00:00:01.540125,3.555531521968879e-06,gbtree,0.462838219658839,0.03431279182374882,0.0002735416491129095,lossguide,0.0005948170710340112,3,3,,,,,0.46130566572295617,COMPLETE
17,17,0.7424767235282947,2023-04-10 20:08:51.575648,2023-04-10 20:09:19.484920,0 days 00:00:27.909272,0.0013668722164386928,dart,0.46678700613263435,0.08130130513158709,0.00011525251072250574,depthwise,0.025823933920441206,2,5,forest,2.847029627811296e-05,weighted,0.006579072092171223,0.4605526598088775,COMPLETE
18,18,0.7024954170754282,2023-04-10 20:09:19.486920,2023-04-10 20:09:48.528284,0 days 00:00:29.041364,5.95165822946725e-05,dart,0.4158180406086212,0.0017265478619391873,0.0001182790589881873,depthwise,0.0002241674982696136,3,3,tree,0.03841770036482104,uniform,0.49195737265457934,0.5446546818161656,COMPLETE
19,19,0.7176083965354264,2023-04-10 20:09:48.531284,2023-04-10 20:09:50.084411,0 days 00:00:01.553127,2.344493028815816e-06,gbtree,0.5315210313416076,0.10913115789842233,2.803307861184322e-05,lossguide,0.013375875337827794,4,5,,,,,0.5806633705444978,COMPLETE
20,20,0.725245703569671,2023-04-10 20:09:50.086410,2023-04-10 20:09:51.619535,0 days 00:00:01.533125,5.706925016147021e-05,gbtree,0.6419175205183985,0.008163957733086114,0.000675506110963445,lossguide,0.001123126238400484,2,3,,,,,0.44864399709169556,COMPLETE
21,21,0.7570192745136082,2023-04-10 20:09:51.622535,2023-04-10 20:10:22.362038,0 days 00:00:30.739503,0.0033509109332049056,dart,0.4447368098738561,0.08824677759156214,0.00017425851065127961,depthwise,0.037712976939826344,2,5,forest,6.297466326273595e-05,weighted,0.007509385349776105,0.4495024088999037,COMPLETE
22,22,0.7606716518321459,2023-04-10 20:10:22.364037,2023-04-10 20:10:53.444568,0 days 00:00:31.080531,0.03372806145976342,dart,0.4752464395037324,0.11955764904150795,1.7201743021389807e-05,depthwise,0.1109266404570408,2,7,forest,0.0005099358700087972,weighted,0.008040712090619713,0.4541518041108127,COMPLETE
23,23,0.754222861238587,2023-04-10 20:10:53.447567,2023-04-10 20:11:24.770117,0 days 00:00:31.322550,0.0017696477253892518,dart,0.48004101964136653,0.05656648872912919,0.0002730227747969988,depthwise,0.08601129338534835,2,7,forest,2.8446177282644743e-05,weighted,0.0027628899502482674,0.43875696352134486,COMPLETE
24,24,0.7132932827981089,2023-04-10 20:11:24.772117,2023-04-10 20:11:56.533702,0 days 00:00:31.761585,0.08579104539587117,dart,0.4879538083548403,0.09664632262701828,4.044158109932325e-05,depthwise,0.246475429027405,1,7,forest,1.8325446664990503e-06,weighted,0.0020390456775875258,0.30498919218530296,COMPLETE
25,25,0.6981829487827096,2023-04-10 20:11:56.536702,2023-04-10 20:12:27.119191,0 days 00:00:30.582489,0.00028442625736900155,dart,0.5394532542833462,0.0036462352290493037,1.2857152215910087e-05,depthwise,0.01215761385174213,2,8,forest,0.0003248396234092338,weighted,0.02440719713559238,0.46836397383786565,COMPLETE
26,26,0.7323252897311829,2023-04-10 20:12:27.122192,2023-04-10 20:12:56.257563,0 days 00:00:29.135371,0.014510948848051342,dart,0.3709262132265914,0.9919845232017546,0.00042353379300260263,depthwise,0.19318680796904578,4,8,forest,0.00017615393643777202,weighted,0.000328679272171458,0.3759961107274228,COMPLETE
27,27,0.7185232892287887,2023-04-10 20:12:56.260563,2023-04-10 20:13:30.875381,0 days 00:00:34.614818,0.0053985984643711285,dart,0.46350804024897685,0.025578987881497442,0.0028540249794445855,depthwise,0.6749546089885771,3,4,forest,1.9800638283062117e-06,weighted,0.0012899185150453054,0.6202849152713052,COMPLETE
28,28,0.7482964790978756,2023-04-10 20:13:30.878381,2023-04-10 20:13:32.315498,0 days 00:00:01.437117,0.1997486843613344,gbtree,0.4377605711495976,0.24386613106098762,0.00023908087952827754,lossguide,0.03709953854034372,2,7,,,,,0.47353734720796353,COMPLETE
29,29,0.7167658900646086,2023-04-10 20:13:32.318499,2023-04-10 20:14:02.026916,0 days 00:00:29.708417,0.058377936248137245,dart,0.5773328461312861,0.0005378577084947165,1.481877607509343e-05,depthwise,0.00903129974075272,1,6,forest,0.0022084263309546256,weighted,0.022703005253086838,0.329538264570973,COMPLETE
30,30,0.7354927226165107,2023-04-10 20:14:02.028916,2023-04-10 20:14:33.652491,0 days 00:00:31.623575,0.0013725382104635044,dart,0.37732335049445975,0.011206522575884092,0.010648744401975144,depthwise,0.08910847349212393,3,3,forest,0.00011720061360230042,weighted,0.08616686624476161,0.41704440827630057,COMPLETE
31,31,0.7280201057735672,2023-04-10 20:14:33.654491,2023-04-10 20:15:01.552763,0 days 00:00:27.898272,0.024131519514166134,dart,0.37950278348111,0.24102839752469135,5.04991522071045e-07,depthwise,0.005176790576894572,6,5,tree,0.02125606211913176,uniform,0.0913420782727951,0.5366626766826998,COMPLETE
32,32,0.7276434822516954,2023-04-10 20:15:01.555763,2023-04-10 20:15:30.003083,0 days 00:00:28.447320,0.02407600142159715,dart,0.4432528772233838,0.037682776852119855,4.707101818227406e-08,depthwise,0.0006329883797333613,4,5,forest,0.07071068047958716,weighted,0.1865163962305063,0.5751812336666251,COMPLETE
33,33,0.7438510854672173,2023-04-10 20:15:30.005078,2023-04-10 20:16:00.461556,0 days 00:00:30.456478,0.12085013932426521,dart,0.25471814113130353,0.269861657284581,9.400610701936727e-07,depthwise,0.020698153095288982,8,4,tree,0.002223772309048194,uniform,0.04503297927745649,0.39632632991345523,COMPLETE
34,34,0.6907207985695286,2023-04-10 20:16:00.463556,2023-04-10 20:16:33.943283,0 days 00:00:33.479727,0.4766460605909233,dart,0.35837202689378356,0.015512394525800053,1.164411748519916e-07,depthwise,0.002749433580129805,6,2,forest,0.18628158789678664,weighted,0.6992985584191638,0.3505066547052845,COMPLETE
35,35,0.7402450866603182,2023-04-10 20:16:33.946282,2023-04-10 20:16:35.498408,0 days 00:00:01.552126,0.21938094489777554,gbtree,0.26425737188854237,0.09584807890941358,0.00014433826968689094,lossguide,0.9327948615982136,2,6,,,,,0.484820024619235,COMPLETE
36,36,0.7171403391203375,2023-04-10 20:16:35.500408,2023-04-10 20:16:37.818598,0 days 00:00:02.318190,0.0273619518878352,dart,0.506352557506523,0.3667642066826282,9.348984573544021e-06,depthwise,0.2262263748732193,1,4,tree,0.9777743036449257,uniform,0.00820995455040171,0.6712202156377228,COMPLETE
37,37,0.7163627043584133,2023-04-10 20:16:37.821597,2023-04-10 20:16:39.398726,0 days 00:00:01.577129,2.866929896768527e-06,gbtree,0.40958122356070537,0.041828190724171974,5.0783106957312336e-05,lossguide,0.0002793376118885562,3,6,,,,,0.4040676358035538,COMPLETE
38,38,0.7206360351166942,2023-04-10 20:16:39.401726,2023-04-10 20:17:10.310242,0 days 00:00:30.908516,0.057758009000411004,dart,0.5779867947466388,0.011687391925240787,6.668494014468546e-07,depthwise,0.003823576292683191,4,5,forest,0.01233605065397223,weighted,0.007422417793118745,0.5661752769205,COMPLETE
39,39,0.7315311995743357,2023-04-10 20:17:10.313242,2023-04-10 20:17:11.889371,0 days 00:00:01.576129,5.92588407052043e-07,gbtree,0.4527396130974942,0.16716212361292276,0.00070016939204325,lossguide,0.0017283174444972604,8,9,,,,,0.4991382881315157,COMPLETE
40,40,0.7445195676356269,2023-04-10 20:17:11.892371,2023-04-10 20:17:37.824482,0 days 00:00:25.932111,0.0027379649319379962,dart,0.5013152817540714,0.47753377959810733,5.240873304458858e-06,depthwise,0.028929960691546474,3,2,forest,0.21922853110885723,weighted,0.2123697719522746,0.28544876168961,COMPLETE
41,41,0.7728631662882581,2023-04-10 20:17:37.827482,2023-04-10 20:18:09.195035,0 days 00:00:31.367553,0.001451261472095012,dart,0.4706244316244067,0.05489774099114006,0.0002756528156185697,depthwise,0.07982892796492788,2,7,forest,4.0406468466745247e-05,weighted,0.0017894830166255082,0.4434218143922539,COMPLETE
42,42,0.7422151826732797,2023-04-10 20:18:09.198035,2023-04-10 20:18:39.019462,0 days 00:00:29.821427,0.0005451759782991451,dart,0.41893866011426933,0.0807064034064511,0.00021381116446588856,depthwise,0.05297495661394891,2,7,forest,0.0008894188236200654,weighted,0.0011587027428574845,0.43133932566405864,COMPLETE
43,43,0.7285893357575173,2023-04-10 20:18:39.021462,2023-04-10 20:19:08.070827,0 days 00:00:29.049365,0.010223225936980287,dart,0.5179194253105183,0.16477585425885546,8.365413236609345e-05,depthwise,0.011166325015176625,1,6,forest,7.127035272237805e-05,weighted,0.030059721307892088,0.5339589291785907,COMPLETE
44,44,0.7100179792961021,2023-04-10 20:19:08.073827,2023-04-10 20:19:35.957097,0 days 00:00:27.883270,0.0038037341265821298,dart,0.3594700237608445,0.005011526116845612,1.8472113253022016e-06,depthwise,0.3597274669363086,7,8,forest,6.778215201773838e-06,weighted,0.004890925617535643,0.3535650057703325,COMPLETE
45,45,0.7299107505219513,2023-04-10 20:19:35.960097,2023-04-10 20:20:05.055466,0 days 00:00:29.095369,0.00957409643245026,dart,0.4742474954504818,0.028218811443022317,2.9877865440225406e-07,depthwise,0.1286809325948115,2,7,forest,0.000720217269503126,uniform,0.0007998864053385985,0.4895655050380618,COMPLETE
46,46,0.7204318564499025,2023-04-10 20:20:05.058466,2023-04-10 20:20:06.564588,0 days 00:00:01.506122,0.000856059995151649,gbtree,0.5464183090113612,0.5147487660984358,2.146717417711596e-05,lossguide,0.0967186449785975,3,9,,,,,0.41275691921664664,COMPLETE
47,47,0.7525602079123085,2023-04-10 20:20:06.567588,2023-04-10 20:20:34.134834,0 days 00:00:27.567246,0.00023621167009360238,dart,0.4022936404488079,0.06553767623128519,6.938322376923454e-06,depthwise,0.43892387519782533,9,6,forest,0.0042993484982142465,weighted,0.04611935842424071,0.4601211862980554,COMPLETE
48,48,0.6934115803654739,2023-04-10 20:20:34.137832,2023-04-10 20:21:03.251205,0 days 00:00:29.113373,0.002326124885444872,dart,0.33365911757273403,0.014218184940844598,9.617111435088737e-08,depthwise,0.03998494519444434,6,8,tree,0.00031968014718641543,uniform,0.014355255137457725,0.5074415811334628,COMPLETE
49,49,0.7457868949844795,2023-04-10 20:21:03.254204,2023-04-10 20:21:04.874334,0 days 00:00:01.620130,0.00015751617523824003,gbtree,0.4419126697832481,0.43918765545163874,5.8080932439308355e-05,lossguide,0.0005598198296755131,5,7,,,,,0.6042625968068744,COMPLETE
50,50,0.7697654612929254,2023-04-10 20:21:04.877335,2023-04-10 20:21:30.120390,0 days 00:00:25.243055,0.0005090647726173506,dart,0.6156115304087594,0.13175837062042126,1.9020979518365868e-06,depthwise,0.006850873491484573,1,5,tree,0.00656849324138552,weighted,0.003112627878876573,0.378144391015047,COMPLETE
51,51,0.7546503895023285,2023-04-10 20:21:30.123389,2023-04-10 20:21:55.388446,0 days 00:00:25.265057,0.0006654529094333474,dart,0.6109069733317967,0.1672927107710042,1.3143507126555277e-08,depthwise,0.005712898014608097,1,5,tree,0.007914741792601722,weighted,0.006926535512482036,0.3802055333567382,COMPLETE
52,52,0.6991167643706502,2023-04-10 20:21:55.391446,2023-04-10 20:22:19.214385,0 days 00:00:23.822939,0.003748196088381457,dart,0.6648279389419729,0.07877705448240709,2.3198057975216106e-05,depthwise,0.002150639755653235,1,5,tree,0.07275043469154799,weighted,0.003087943475730165,0.43646569604545826,COMPLETE
53,53,0.7442006632691436,2023-04-10 20:22:19.216385,2023-04-10 20:22:46.707622,0 days 00:00:27.491237,8.110630232514936e-05,dart,0.491798065649433,0.15774693770320597,3.769886459630445e-06,depthwise,0.021757880715535954,2,6,tree,0.006174989358825806,weighted,0.00034821626271208395,0.4008816486247992,COMPLETE
54,54,0.7389719403634912,2023-04-10 20:22:46.710623,2023-04-10 20:23:15.850996,0 days 00:00:29.140373,3.411265344705602e-05,dart,0.5618127675967248,0.03070164731661543,1.4661405644516494e-06,depthwise,0.001223991598522066,2,4,tree,0.0009663466727350805,weighted,3.906237942605162e-05,0.4493570559714588,COMPLETE
55,55,0.6905364561272586,2023-04-10 20:23:15.853995,2023-04-10 20:23:41.150055,0 days 00:00:25.296060,0.0001388037716161289,dart,0.5244990137770994,0.7081649985084999,5.209155774103576e-08,depthwise,0.058513069812744255,1,3,tree,7.509516358829425e-05,uniform,0.0005438197435794216,0.5094603749911385,COMPLETE
56,56,0.750047045302767,2023-04-10 20:23:41.153054,2023-04-10 20:23:42.899196,0 days 00:00:01.746142,0.0011943772952470548,gbtree,0.47097857453994624,0.048266732353558967,9.310126363113233e-05,lossguide,0.005220523111907281,3,5,,,,,0.47401743672069513,COMPLETE
57,57,0.7081076708310449,2023-04-10 20:23:42.901196,2023-04-10 20:24:08.586288,0 days 00:00:25.685092,0.0005010330711711404,dart,0.42673856682250244,0.007828552441479213,3.176300987695953e-05,depthwise,0.014523911517533655,1,4,tree,0.00033246573385092935,weighted,0.0025668446026422226,0.5578630866219666,COMPLETE
58,58,0.7190478961766853,2023-04-10 20:24:08.589288,2023-04-10 20:24:34.676410,0 days 00:00:26.087122,0.007170485121326003,dart,0.5388232276378636,0.9294349422895597,8.412098678813532e-06,depthwise,0.16127777077032454,2,7,tree,0.027231910449368717,uniform,0.01377661745085172,0.3586011468570788,COMPLETE
59,59,0.722090243647733,2023-04-10 20:24:34.679411,2023-04-10 20:24:36.271542,0 days 00:00:01.592131,0.0018181858405234338,gbtree,0.3912959661966539,0.02058656015086066,3.447148627913023e-07,lossguide,0.00013631205532507864,2,6,,,,,0.5326631127706823,COMPLETE
60,60,0.7298328522376097,2023-04-10 20:24:36.274541,2023-04-10 20:24:57.404260,0 days 00:00:21.129719,0.0156740516415522,dart,0.5997389099566025,0.310941017869474,0.0005078839007830615,depthwise,0.008270600075883464,7,6,forest,0.2329874403727735,weighted,0.0001662658124435189,0.4213264743320358,COMPLETE
61,61,0.757505875636056,2023-04-10 20:24:57.407261,2023-04-10 20:25:23.205361,0 days 00:00:25.798100,0.0007282532607490728,dart,0.625833642688504,0.18658945437998384,1.4280224004418403e-08,depthwise,0.00331781251714263,1,5,tree,0.011269429058230921,weighted,0.004937473479196239,0.3841467013336376,COMPLETE
62,62,0.768748511357113,2023-04-10 20:25:23.208361,2023-04-10 20:25:50.179557,0 days 00:00:26.971196,0.0003438038229378479,dart,0.6201781749181604,0.12281755364696036,2.01604000670354e-08,depthwise,0.0033215005009585093,1,5,tree,0.003282844769440157,weighted,0.001438274824167264,0.3761958075867565,COMPLETE
63,63,0.728210952904851,2023-04-10 20:25:50.182556,2023-04-10 20:26:17.576786,0 days 00:00:27.394230,0.0003356299905903953,dart,0.6282819066516293,0.04694062075029069,1.000691761246453e-08,depthwise,0.0010445015958384036,1,5,tree,0.0026314691706030065,weighted,0.0014915180628816708,0.38055661152304393,COMPLETE
64,64,0.7536573558460146,2023-04-10 20:26:17.579786,2023-04-10 20:26:43.701914,0 days 00:00:26.122128,0.0007182303041706701,dart,0.678473227191374,0.127020363759437,4.8280186051047605e-08,depthwise,0.002678979198824681,1,4,tree,0.006870452242840551,weighted,0.003845598385952938,0.2752875862233001,COMPLETE
65,65,0.7282540435428502,2023-04-10 20:26:43.705913,2023-04-10 20:27:15.932536,0 days 00:00:32.226623,0.00018453990451971437,dart,0.5651285993151611,0.06513661106052002,1.547976686854529e-07,depthwise,0.018414317342592516,1,5,tree,0.001008194660378439,weighted,0.0007158107844867285,0.33774207897490083,COMPLETE
66,66,0.7421608285160582,2023-04-10 20:27:15.935536,2023-04-10 20:27:41.851645,0 days 00:00:25.916109,0.0009510496387970256,dart,0.7030535105195425,0.26599164343102216,3.247434139831496e-08,depthwise,0.0004836956863607086,2,6,tree,0.011459505051216415,weighted,0.0018328160112677833,0.3169580697085935,COMPLETE
67,67,0.7277339111301273,2023-04-10 20:27:41.854646,2023-04-10 20:28:07.485733,0 days 00:00:25.631087,0.0004023990461323,dart,0.5954984294180903,0.019183302443452403,2.1820950648453644e-08,depthwise,0.05317533998964151,1,3,forest,0.00198249143750453,weighted,0.0037504439094703987,0.3606907950930933,COMPLETE
68,68,0.7414221059456789,2023-04-10 20:28:07.488733,2023-04-10 20:28:35.020974,0 days 00:00:27.532241,0.00010125801321046825,dart,0.6363258870365258,0.11786322358461232,0.00016791561557612808,depthwise,0.009689638153436693,2,4,tree,0.00022316383808997843,weighted,0.011053981993690072,0.38291603055974716,COMPLETE
69,69,0.7307540734559541,2023-04-10 20:28:35.023973,2023-04-10 20:29:01.876159,0 days 00:00:26.852186,0.0037547281846271935,dart,0.7393388719826364,0.04250148500418461,0.0003262742927823055,lossguide,0.03220241314455868,3,7,forest,0.00044229183635921326,weighted,0.0011686806597228162,0.44832633328694954,COMPLETE
70,70,0.7091878816051861,2023-04-10 20:29:01.879159,2023-04-10 20:29:03.376281,0 days 00:00:01.497122,0.001836742495375647,gbtree,0.5107446010918874,0.0026307873022097844,1.9013652487494615e-08,depthwise,0.003556629572815165,1,8,,,,,0.32887365774480354,COMPLETE
71,71,0.7476520800894979,2023-04-10 20:29:03.379282,2023-04-10 20:29:32.158624,0 days 00:00:28.779342,0.0013141533600171096,dart,0.4614252327896849,0.4831366645661121,9.58074364484162e-08,depthwise,0.0018148775480267463,2,5,tree,0.04290032394534354,weighted,0.022878109224994968,0.42616665092254885,COMPLETE
